[
  {
    "uniqueId": "AF-0000000300000001_v1_A",
    "toolUsed": "ColabFold v1.6.0 / AlphaFold-Multimer",
    "modelCreatedDate": "2026-05-22T00:00:00Z",
    "modelEntityId": "AF-0000000300000001",
    "isComplex": false,
    "uniprotAccession": "O00400",
    "uniprotId": "ACATN_HUMAN",
    "uniprotDescription": "Acetyl-coenzyme A transporter 1",
    "gene": "SLC33A1",
    "geneSynonyms": [
      "ACATN",
      "AT1"
    ],
    "taxId": 9606,
    "organismScientificName": "Homo sapiens (Human)",
    "organismCommonNames": [
      "Human"
    ],
    "sequence": "MSPTISHKDSSRQRRPGNFSHSLDMKSGPLPPGGWDDSHLDSAGREGDREALLGDTGTGDFLKAPQSFRAELSSILLLLFLYVLQGIPLGLAGSIPLILQSKNVSYTDQAFFSFVFWPFSLKLLWAPLVDAVYVKNFGRRKSWLVPTQYILGLFMIYLSTQVDRLLGNTDDRTPDVIALTVAFFLFEFLAATQDIAVDGWALTMLSRENVGYASTCNSVGQTAGYFLGNVLFLALESADFCNKYLRFQPQPRGIVTLSDFLFFWGTVFLITTTLVALLKKENEVSVVKEETQGITDTYKLLFAIIKMPAVLTFCLLILTAKIGFSAADAVTGLKLVEEGVPKEHLALLAVPMVPLQIILPLIISKYTAGPQPLNTFYKAMPYRLLLGLEYALLVWWTPKVEHQGGFPIYYYIVVLLSYALHQVTVYSMYVSIMAFNAKVSDPLIGGTYMTLLNTVSNLGGNWPSTVALWLVDPLTVKECVGASNQNCRTPDAVELCKKLGGSCVTALDGYYVESIICVFIGFGWWFFLGPKFKKLQDEGSSSWKCKRNN",
    "sequenceChecksum": "464c8b39b7d236c9c0eb7410cba3a93f",
    "sequenceVersionDate": "1997-07-01T00:00:00Z",
    "sequenceStart": 1,
    "sequenceEnd": 549,
    "isIsoform": false,
    "isFragment": false,
    "isUniProt": true,
    "isUniProtReferenceProteome": true,
    "isUniProtReviewed": true,
    "globalMetricValue": 81.38,
    "fractionPlddtVeryLow": 0.14,
    "fractionPlddtLow": 0.03,
    "fractionPlddtConfident": 0.33,
    "fractionPlddtVeryHigh": 0.51,
    "latestVersion": 1,
    "allVersions": [
      1
    ],
    "providerId": "EXAMPLE",
    "entityType": "protein",
    "isAMdata": false
  },
  {
    "uniqueId": "AF-0000000300000002_v1_A",
    "toolUsed": "ColabFold v1.6.0 / AlphaFold-Multimer",
    "modelCreatedDate": "2026-05-22T00:00:00Z",
    "modelEntityId": "AF-0000000300000002",
    "isComplex": false,
    "uniprotAccession": "O64637",
    "uniprotId": "C76C2_ARATH",
    "uniprotDescription": "Cytochrome P450 76C2",
    "gene": "CYP76C2",
    "geneSynonyms": [
      "YLS6"
    ],
    "taxId": 3702,
    "organismScientificName": "Arabidopsis thaliana (Mouse-ear cress)",
    "organismCommonNames": [
      "Mouse-ear cress"
    ],
    "sequence": "MDIIFEQALFPLFCFVLSFFIIFFTTTRPRSSRKVVPSPPGPPRLPIIGNIHLVGRNPHHSFADLSKTYGPIMSLKFGSLNTVVVTSPEAAREVLRTYDQILSSRTPTNSIRSINHDKVSVVWLPPSSSRWRLLRKLSATQLFSPQRIEATKTLRENKVKELVSFMSESSEREEAVDISRATFITALNIISNILFSVDLGNYDSNKSGVFQDTVIGVMEAVGNPDAANFFPFLGFLDLQGNRKTLKACSERLFKVFRGFIDAKLAEKSLRDTNSKDVRERDFVDVLLDLTEGDEAELNTNDIVHLLLDLFGAGTDTNSSTVEWAMAELLRNPETMVKAQAEIDCVIGQKGVVEESDISALPYLQAVVKETFRLHPAAPLLVPRKAESDVEVLGFMVPKDTQVFVNVWAIGRDPNVWENSSRFKPERFLGKDIDLRGRDYELTPFGAGRRICPGLPLAVKTVPLMLASLLYSFDWKLPNGVGSEDLDMDETFGLTLHKTNPLHAVPVKKRGRN",
    "sequenceChecksum": "c2901fa6e533ebf8482625d486f87c66",
    "sequenceVersionDate": "1998-08-01T00:00:00Z",
    "sequenceStart": 1,
    "sequenceEnd": 512,
    "isIsoform": false,
    "isFragment": false,
    "isUniProt": true,
    "isUniProtReferenceProteome": true,
    "isUniProtReviewed": true,
    "globalMetricValue": 92.19,
    "fractionPlddtVeryLow": 0.02,
    "fractionPlddtLow": 0.06,
    "fractionPlddtConfident": 0.1,
    "fractionPlddtVeryHigh": 0.83,
    "latestVersion": 1,
    "allVersions": [
      1
    ],
    "providerId": "EXAMPLE",
    "entityType": "protein",
    "isAMdata": false
  },
  {
    "uniqueId": "AF-0000000300000003_v1_A",
    "toolUsed": "ColabFold v1.6.0 / AlphaFold-Multimer",
    "modelCreatedDate": "2026-05-22T00:00:00Z",
    "modelEntityId": "AF-0000000300000003",
    "isComplex": false,
    "uniprotAccession": "Q9TVL3",
    "uniprotId": "CDK9_CAEEL",
    "uniprotDescription": "Probable cyclin-dependent kinase 9",
    "gene": "cdk-9",
    "taxId": 6239,
    "organismScientificName": "Caenorhabditis elegans",
    "sequence": "MSAQNYHAGLHQSSTQRPPKRPNTEHAQEPPKRALIGGQTTPSSSGGGQTPNGTNYELEVKQQLSNYQKLFDQATYPFIRDVSTYEKLNKIGQGTFGEVFKARCKNTGRMVALKKILMENEKEGFPITALREVKMLEQLKHPNITDLIEVCSAKSTGTTGSKDRATFYLVMALCAHDLAGLLSNPKIRMSLVHIKTMMKHLMSGLNKLHRSKILHRDMKAANVLISKDGILKLADFGLARPFVQRENGAGPRPLYTNRVVTLWYRPPELLLGDRQYGTKIDVWGAGCIMAEMWTRQPIMQGDTEQKQLQLISGLCGSINKDVWPNCVNMPLWSAMSSEPNSALPQGKYRILPNKMKNLMKFDAPDSKTDPFGKNVKQHDSATDDDALHLLEILLAIDPDKRPTSDEAEDDIWFFKDPVPMANVQDLMDTIPNSQFEYTVGKGAHANRGRHQNAQQRPNQQQARPSNAIPAGQYRDTIF",
    "sequenceChecksum": "8ac2d3b4e8ed5e4405edb49ac06f6307",
    "sequenceVersionDate": "2005-03-01T00:00:00Z",
    "sequenceStart": 1,
    "sequenceEnd": 478,
    "isIsoform": false,
    "isFragment": false,
    "isUniProt": true,
    "isUniProtReferenceProteome": true,
    "isUniProtReviewed": true,
    "globalMetricValue": 76.47,
    "fractionPlddtVeryLow": 0.2,
    "fractionPlddtLow": 0.12,
    "fractionPlddtConfident": 0.18,
    "fractionPlddtVeryHigh": 0.49,
    "latestVersion": 1,
    "allVersions": [
      1
    ],
    "providerId": "EXAMPLE",
    "entityType": "protein",
    "isAMdata": false
  }
]
